index	genre	filename	year	old_index	source1	source2	sentence1	sentence2	score
1008	main-captions	images	2014	10	none	none	A group of people eat at a table outside.	Group of elderly people sitting around a table.	2.8
11	main-captions	MSRvid	2012test	18	none	none	A woman picks up and holds a baby kangaroo.	A woman picks up and holds a baby kangaroo in her arms.	4.6
48	main-captions	MSRvid	2012test	71	none	none	A kid is playing guitar.	A boy is playing a guitar.	3.8
470	main-captions	MSRvid	2012test	708	none	none	A woman is dicing a potato.	A woman cuts tofu into tiny pieces.	1.8
1752	main-captions	images	2015	768	none	none	A snowboarder rides a snowboard down a railing beside a flight of steps.	A boy is grinding a skateboard down a concrete wall.	0.8
116	main-captions	MSRvid	2012test	168	none	none	A woman is flipping pancakes.	A cartoon chef is flipping pancakes.	2.533
1296	main-captions	images	2014	435	none	none	Two goats standing in a field by a tree.	A large boat pulling a small white boat.	0.0
728	main-captions	MSRvid	2012train	337	none	none	A woman puts slabs of meat in a pan.	A man puts pieces of meat into a plastic bag.	2.4
5767	main-captions	MSRvid	2012test	79	none	none	Kittens are eating food.	Kittens are eating from dishes.	4.0
29	main-captions	MSRvid	2012test	46	none	none	A girl is flying a kite.	A girl running is flying a kite.	4.0
1091	main-captions	images	2014	128	none	none	A couple posing for a picture on a couch.	Young couple sitting on couch.	4.0
6229	main-captions	images	2015	1208	none	none	Two boys are jumping into a pool.	Two boys are in midair jumping into an inground pool.	4.2
6283	main-captions	track5.en-en	2017	79	none	none	A woman paints a picture of a large building which can be seen in the background.	A person paints a picture of a large building which can be seen in the background.	4.2
1333	main-captions	images	2014	490	none	none	A group of people sitting at a restaurant table.	Group of people sitting at table of restaurant.	4.6
1916	main-captions	images	2015	1253	none	none	A young girl with a pink hat on with a yellow building in the background.	A young girl in a pink dress with something in her hand.	1.8
1135	main-captions	images	2014	197	none	none	A pot of liquid is at the center of a tinfoil covered plate.	A pot of food is placed in the center of a red tablecloth.	1.4
785	main-captions	MSRvid	2012train	425	none	none	A woman is swinging her arms.	A woman is slicing an onion.	0.8
457	main-captions	MSRvid	2012test	690	none	none	The girl flew her kite while she ran up a hill.	A girl loses her kite.	2.25
5955	main-captions	MSRvid	2012train	476	none	none	Someone is greating a carrot.	A woman is grating an orange food.	2.5
741	main-captions	MSRvid	2012train	353	none	none	A big turtle is walking.	The tortoise is walking.	4.25
6183	main-captions	images	2015	698	none	none	Two dogs fighting in the snow.	Two dogs play in the snow.	3.2
6250	main-captions	track5.en-en	2017	2	none	none	A woman supervisor is instructing the male workers.	A woman is working as a nurse.	1.0
963	main-captions	MSRvid	2012train	693	none	none	A dog is running around a yard.	A black pet dog runs around in the garden of a house.	3.2
264	main-captions	MSRvid	2012test	394	none	none	A man is slicing a potato.	A woman is cutting a jalepeno.	1.4
1018	main-captions	images	2014	27	none	none	A woman in a gray shirt smiles for the camera while the woman behind her makes a face.	A woman with a surprised look on her face is holding a smiling woman from behind.	2.6
5	main-captions	MSRvid	2012test	11	none	none	Some men are fighting.	Two men are fighting.	4.25
6130	main-captions	images	2015	126	none	none	A black and white dog is running in a grassy garden surrounded by a white fence.	A black and white dog is jumping over a hurdle.	2.2
1539	main-captions	images	2015	157	none	none	Man is carrying a tool box down the sidewalk.	A woman is riding a blue bicycle in a park.	0.0
549	main-captions	MSRvid	2012train	84	none	none	A group of people are marching in place.	A group of people are dancing in concert.	1.7
6210	main-captions	images	2015	931	none	none	Three dogs playing in the snow while one dog wears a jacket.	Three dogs playing in the snow, with a city in the background.	3.4
1879	main-captions	images	2015	1163	none	none	A person on a snowmobile.	A person on a snowmobile in mid jump.	3.6
1194	main-captions	images	2014	289	none	none	a black and white photo of a cat lying down.	A black and white image of a cat laying on a rug.	4.2
1677	main-captions	images	2015	528	none	none	Two surfers on riding a small wave.	Two surfers perform tricks in the waves.	3.6
1076	main-captions	images	2014	103	none	none	The seagull is floating on the water.	A little bird floating in the water.	3.6
1226	main-captions	images	2014	333	none	none	Two guys sit on a couch holding beers with a girl lying on their laps.	Two women watching the street with their bikes to see when they may cross.	0.0
5869	main-captions	MSRvid	2012test	697	none	none	The lady stirred up raw eggs in the bowl.	A woman is pouring eyes into a bowl.	1.0
6016	main-captions	images	2014	97	none	none	A woman posing by a pillar with a U2 sign.	"a woman is standing by a pillar where ""u2"" is written."	4.2
1321	main-captions	images	2014	469	none	none	A red double decker bus on a city street.	A red double decker bus driving down a street.	4.8
633	main-captions	MSRvid	2012train	202	none	none	A cat stares into the camera.	A cat addresses the camera.	3.0
814	main-captions	MSRvid	2012train	473	none	none	A man is riding on one wheel on a motorcycle.	A person is performing tricks on a motorcycle.	3.0
111	main-captions	MSRvid	2012test	163	none	none	A woman is playing flute.	A woman plays on a flute.	4.6
5923	main-captions	MSRvid	2012train	332	none	none	A woman is slicing a big pepper.	A person is cutting a green pepper.	3.4
619	main-captions	MSRvid	2012train	183	none	none	A man is playing keyboard.	A man is playing guitar.	1.8
151	main-captions	MSRvid	2012test	223	none	none	A man is cutting a fish.	A man guts a fish.	3.0
1664	main-captions	images	2015	504	none	none	A man and a dog are playing tug of war.	A man dances on a colorful wall.	0.4
6236	main-captions	images	2015	1328	none	none	A skier is jumping in the air over a snowfield near a mountain range.	A woman is sitting near a flower bed overlooking a tunnel.	0.0
1147	main-captions	images	2014	212	none	none	A passenger train coming into a station.	A large bird is flying through the air.	0.0
6286	main-captions	track5.en-en	2017	84	none	none	A little boy is drinking from a juice packet.	A boy is drinking from a juice packet.	4.8
21	main-captions	MSRvid	2012test	31	none	none	A man is playing a guitar.	A girl is playing a guitar.	2.8
920	main-captions	MSRvid	2012train	626	none	none	A girl is reading a newspaper.	A chef is peeling a potato.	0.0
1047	main-captions	images	2014	66	none	none	Black and white cat lying under bush.	The black and white cat with yellow eyes lounges in the dirt.	2.4
423	main-captions	MSRvid	2012test	634	none	none	A woman slices a lemon.	A man is talking into a microphone.	0.0
1437	main-captions	images	2014	648	none	none	Little white lamb with nose to wood.	A white lamb with its nose against a wooden box.	3.8
1294	main-captions	images	2014	432	none	none	Small boat going down a creek.	a boat moving in a river.	3.0
23	main-captions	MSRvid	2012test	34	none	none	A woman is eating something.	A woman is eating meat.	3.0
700	main-captions	MSRvid	2012train	296	none	none	Men are running a race.	Racers are running down a track.	2.6
6273	main-captions	track5.en-en	2017	56	none	none	A blonde woman looks for medical supplies for work in a suitcase.	The blond woman is searching for medical supplies in a suitcase.	5.0
6225	main-captions	images	2015	1165	none	none	Children are playing on a trampoline in the snow.	Several children and jumping on a trampoline in the snow.	4.5
6168	main-captions	images	2015	501	none	none	Two girls walking in the ocean.	two girls walking in the street	1.8
6112	main-captions	images	2014	734	none	none	Black and white cow standing in grassy field.	A black and white photo of a man standing next to a bus.	0.8
1650	main-captions	images	2015	469	none	none	A dog leaping over a hurdle.	A dog leaps over the hurdle.	4.8
1072	main-captions	images	2014	99	none	none	A black and white sheep is walking next to a white sheep.	Little black and white calf with a tag on its ear.	0.8
6318	main-captions	track5.en-en	2017	138	none	none	They are preparing for a performance at school.	Two medical professionals in green look on at something.	0.0
1726	main-captions	images	2015	683	none	none	Man standing on top of jagged rocks near the ocean.	A man is standing on top of rocks overlooking the ocean.	4.6
5927	main-captions	MSRvid	2012train	352	none	none	A person drops a camera down an escelator.	A man tosses a bag down an escalator.	2.75
6020	main-captions	images	2014	134	none	none	The black and brown cow is looking at the camera.	The black and white bull is looking at the camera.	3.6
5756	main-captions	MSRvid	2012test	23	none	none	A woman is carrying a boy.	A woman is carrying her baby.	2.333
1434	main-captions	images	2014	644	none	none	Two young women shear a sheep.	Two women sheering a sheep.	4.4
1497	main-captions	images	2015	3	none	none	A pair of dogs playing with a purple ball.	Two dogs play with purple football.	4.4
1685	main-captions	images	2015	552	none	none	A man and dog on a rocky seashore.	Man and dog standing on rocks next to water	4.8
1469	main-captions	images	2014	705	none	none	Double decker bus with the London Eye ferris wheel in background.	a brown double decker tour bus on a street with a ferris wheel behind it.	4.2
1142	main-captions	images	2014	206	none	none	Group of people sitting at table with drinks.	four people sitting at a table.	3.0
5902	main-captions	MSRvid	2012train	181	none	none	The man is buttering the bread.	The man is stirring the rice.	0.4
930	main-captions	MSRvid	2012train	640	none	none	A dog is driving a car.	A guy is talking into a microphone.	0.0
5825	main-captions	MSRvid	2012test	451	none	none	The man talked to a girl over the internet camera.	A teenager talks to a girl over a webcam.	2.8
6345	main-captions	track5.en-en	2017	183	none	none	A girl in water without goggles or a swimming cap.	A girl in water, with goggles and swimming cap.	3.0
6288	main-captions	track5.en-en	2017	86	none	none	The biker is doing dangerous stunts.	A biker is doing stunts.	4.4
1692	main-captions	images	2015	569	none	none	A grey hound is active in a grassy field.	A bunch of bikes racing on a track.	0.0
280	main-captions	MSRvid	2012test	416	none	none	A man holds a small animal in one hand.	A man shows off a small monkey.	1.75
382	main-captions	MSRvid	2012test	582	none	none	The man is putting chicken into the container.	A man is putting foods in a box.	2.5
1482	main-captions	images	2014	724	none	none	A black and white cow looking through the fence.	A black and white cat laying on the ground in the sun.	0.6
1793	main-captions	images	2015	880	none	none	A dog is running in the snow.	Two dogs running in the dirt	2.2
1875	main-captions	images	2015	1150	none	none	Two homeless men stand outside with a cardboard sign.	Two homeless young men holding a cardboard sign.	4.6
1807	main-captions	images	2015	928	none	none	Two dogs are running on the grass.	Two dogs running in the dirt	3.6
1406	main-captions	images	2014	603	none	none	A red and gray train is going through a tunnel.	A red and gray train travels through a tunnel amongst the trees.	4.25
624	main-captions	MSRvid	2012train	192	none	none	A man is riding a motorcycle on the highway.	A man is riding a motorcycle.	3.5
1425	main-captions	images	2014	633	none	none	A woman riding a brown horse.	Person dressed in blue riding brown horse.	2.6
491	main-captions	MSRvid	2012test	747	none	none	A person is slicing an onion.	A cat is pooping into a toilet.	0.0
9	main-captions	MSRvid	2012test	16	none	none	A person is throwing a cat on to the ceiling.	A person throws a cat on the ceiling.	5.0
5944	main-captions	MSRvid	2012train	422	none	none	A man is putting a knife in a vice.	A man is getting into a car in a garage.	0.8
1670	main-captions	images	2015	513	none	none	The white and brown dog runs across the grass.	Three dogs are running on the grass.	3.2
6153	main-captions	images	2015	402	none	none	A brown and white dog is catching a tennis ball while standing on its hind legs.	the brown and white dog is carrying a stick in his mouth.	1.8
1833	main-captions	images	2015	1020	none	none	A black dog and a white dog playing in the street.	A black dog and a white dog play in the street together.	4.6
1962	main-captions	images	2015	1382	none	none	Two people sit on a dock near the water.	Two people sit on the end of a dock in the middle of still water.	3.8
762	main-captions	MSRvid	2012train	382	none	none	A woman is cutting flowers.	A man is holding huge sunflowers.	1.0
248	main-captions	MSRvid	2012test	371	none	none	The man played his guitar.	A man is playing a guitar.	3.75
425	main-captions	MSRvid	2012test	637	none	none	The lady cracked two raw eggs.	The woman is cracking eggs into a bowl.	3.2
5987	main-captions	MSRvid	2012train	675	none	none	A man plays the guitar and sings.	A man is singing and playing a guitar.	5.0
1314	main-captions	images	2014	459	none	none	A black train moves down the tracks.	A train traveling down the tracks.	4.0
454	main-captions	MSRvid	2012test	687	none	none	A man is slicing a pepper.	A person cuts a big green pepper apart.	3.8
645	main-captions	MSRvid	2012train	223	none	none	a group of people dancing	A group of men are dancing.	3.4
1285	main-captions	images	2014	419	none	none	A dining table with candles, wine, and a teapot.	A wooden table is set with candles, wine, and a purple plastic bowl.	3.0
777	main-captions	MSRvid	2012train	413	none	none	A man plays a trumpet.	A man is playing a musical instrument.	3.4
1525	main-captions	images	2015	108	none	none	A brown dog is resting its paws on a laptop keyboard.	A dog sits with its paws on a laptop computer.	3.8
922	main-captions	MSRvid	2012train	628	none	none	A man is walking along a path through wilderness.	A man is peeling an onion.	0.75
1237	main-captions	images	2014	348	none	none	Four blue and yellow planes flying over four boats.	Four blue and yellow planes in flight.	4.2
421	main-captions	MSRvid	2012test	632	none	none	A chef is cleaning up a bowl of soup.	A man is wiping the edge of a bowl off.	2.533
129	main-captions	MSRvid	2012test	191	none	none	A woman is picking a can.	A woman is slicing a tomato.	1.0
6036	main-captions	images	2014	224	none	none	Two people sitting on a large motorcycle.	Two eagles sitting on a long branch.	0.4
1619	main-captions	images	2015	371	none	none	A brown dog about to catch a green Frisbee.	A brown dog waits for the Frisbee to come down before catching it.	3.8
396	main-captions	MSRvid	2012test	598	none	none	A man is shaking a container over a kitchen sink.	A man is emptying a plastic container.	2.2
478	main-captions	MSRvid	2012test	721	none	none	Two men are fighting.	The man is exercising.	0.75
1784	main-captions	images	2015	860	none	none	A black and white dog is running through a cow field.	A large black and white dog runs in the ocean water	2.2
1530	main-captions	images	2015	125	none	none	Two Asian men and Asian woman sit in black massage chairs.	Two Asian men and a woman are relaxing in massage chairs.	4.6
5816	main-captions	MSRvid	2012test	404	none	none	A rabbit is playing with a toy rabbit.	A bunny is playing with a stuffed bunny.	4.25
6090	main-captions	images	2014	611	none	none	Two women are sheering a white sheep inside of a wooden building.	Two women shearing a white sheep in a wooden stall.	4.0
978	main-captions	MSRvid	2012train	711	none	none	A couple of policewomen are singing karaoke.	Two women are dancing.	0.8
6091	main-captions	images	2014	616	none	none	A man with glasses and two plastic bottles in the foreground.	A man talking with two water bottles sitting in front of him.	3.0
5910	main-captions	MSRvid	2012train	215	none	none	A boy is riding a horse.	A monkey is riding a bus.	0.4
1326	main-captions	images	2014	480	none	none	Two cows crossing a road intersection.	Two cows cross a paved street.	3.8
1975	main-captions	images	2015	1412	none	none	A surfer on a wave.	A surfer is riding a wave.	4.4
755	main-captions	MSRvid	2012train	370	none	none	A woman is riding a horse.	A man is running on rope.	0.0
664	main-captions	MSRvid	2012train	247	none	none	The men are performing on stage.	The comedic mimes performed on stage.	2.6
71	main-captions	MSRvid	2012test	108	none	none	A tiger cub is making a sound.	A tiger is walking around.	2.0
6268	main-captions	track5.en-en	2017	45	none	none	The dogs are chasing a cat.	The dogs are chasing a black cat.	4.4
714	main-captions	MSRvid	2012train	314	none	none	A man is being put into an abulance.	A man is pouring pasta onto a plate.	0.0
1785	main-captions	images	2015	862	none	none	A man in a straw hat shades his phone while others walk on a busy sidewalk.	A man lies on a street with his headand shoulders under a parked car that is jacked up.	0.6
667	main-captions	MSRvid	2012train	250	none	none	Someone is frying meat.	Someone is playing paino.	0.25
1101	main-captions	images	2014	140	none	none	A white Apple computer sits on the beige carpeting of a bedroom.	An Apple computer sitting on the floor.	3.6
1764	main-captions	images	2015	802	none	none	The man in the red shirt is climbing the side of a mountain.	A man is climbing the side of a mountain.	4.2
1859	main-captions	images	2015	1105	none	none	Two soccer players battle for the ball during an intense match.	Two little orange and white dogs are in the snow.	0.0
6050	main-captions	images	2014	305	none	none	A close-up of a cat on a cream sofa.	A close-up of a horse.	1.2
1655	main-captions	images	2015	481	none	none	A dog leaps off a dock and into the water.	The black dog leaps off the dock and into the water.	4.0
1492	main-captions	images	2014	740	none	none	A train is at a train station.	a train in a station.	5.0
32	main-captions	MSRvid	2012test	50	none	none	A woman is dancing and singing with other women.	A woman is dancing and singing in the rain.	3.0
5934	main-captions	MSRvid	2012train	389	none	none	A person pours cooking oil into a pot.	A person is pouring olive oil into a pot on the stove.	3.8
1107	main-captions	images	2014	148	none	none	Red double decker bus on side of street.	A red double decker bus on a city street.	4.4
1399	main-captions	images	2014	595	none	none	A black and white cat lying on a blanket.	A black and white cat sleeps on a purple blanket.	4.0
1340	main-captions	images	2014	498	none	none	The black and white cat is looking up at the camera.	A grey, black, and white cat looking at the camera.	3.6
5853	main-captions	MSRvid	2012test	575	none	none	A woman is chopping onion.	A man is doing a card trick.	0.0
5838	main-captions	MSRvid	2012test	514	none	none	Batman and Robin fly a helicopter over water.	A helicopter flies over water.	2.6
1324	main-captions	images	2014	475	none	none	A man and two women smiling at the camera while sitting on a blue sofa.	A man and women smiling at the camera while standing in a kitchen.	2.2
925	main-captions	MSRvid	2012train	632	none	none	A man pours liquid into a pan.	The chef poured oil in the pan.	2.6
1396	main-captions	images	2014	588	none	none	A close-up view of the headlights of a blue old-fashioned car.	Close up of the headlights on a blue car.	4.0
1438	main-captions	images	2014	652	none	none	A young girl riding a white and grey horse.	a little girl is riding a white and grey horse.	4.6
356	main-captions	MSRvid	2012test	529	none	none	A person is doing pencil tricks with his hand.	A person is slicing carrots in half.	0.333
1024	main-captions	images	2014	38	none	none	A group of people sitting around a table with food on it.	A group of people sit around a table with food and beer.	4.0
1300	main-captions	images	2014	440	none	none	A close-up of a cat on a cream sofa.	A siamese cat resting on a white sofa.	3.4
6043	main-captions	images	2014	282	none	none	the back of a stop sign with many stickers on it.	The back of a sign with stickers on.	3.8
1298	main-captions	images	2014	438	none	none	Close up of a brown horse with a blue halter.	A close up of a horse wearing a blue halter.	3.6
6348	main-captions	track5.en-en	2017	190	none	none	There are four snowboarders going off a jump and that are in the air.	Two racers are coming to a turn.	1.0
5893	main-captions	MSRvid	2012train	97	none	none	A man is slicing an onion.	A man slices an onion.	5.0
1747	main-captions	images	2015	752	none	none	A dog jumping for a Frisbee in the snow.	A dog is jumping in the snow.	3.2
1144	main-captions	images	2014	209	none	none	A group of river barges with trees in the background.	A group of cows in a field with yellow tags in their ears.	0.2
5859	main-captions	MSRvid	2012test	611	none	none	A person is boiling soup.	A woman is placing eggs into a pan.	0.25
716	main-captions	MSRvid	2012train	316	none	none	A man is firing a shot gun.	A man shoots a shotgun.	5.0
5757	main-captions	MSRvid	2012test	27	none	none	Three men are playing guitars.	Three men are on stage playing guitars.	3.75
829	main-captions	MSRvid	2012train	491	none	none	A girl is eating a cupcake.	A man is playing a trumpet.	0.0
1245	main-captions	images	2014	362	none	none	A group of sheep grazing on a hill.	A group of sheep are on a hill.	4.0
305	main-captions	MSRvid	2012test	456	none	none	A man is looking at a computer monitor.	A man is using a laptop.	2.75
63	main-captions	MSRvid	2012test	93	none	none	A man is riding a motorcycle.	A man is riding a horse.	1.4
6044	main-captions	images	2014	284	none	none	Living room or den with large screen television.	Living room with tan furniture and flat screen television.	3.2
1701	main-captions	images	2015	597	none	none	A man and a woman looking at the camera.	A man and a woman laughing.	2.33
482	main-captions	MSRvid	2012test	728	none	none	The hedgehog chewed on the towel.	A hedgehog is biting at a blanket.	3.4
1368	main-captions	images	2014	542	none	none	A women laying across two men sitting on a sofa.	Two men in shorts are sitting on a sofa.	2.0
459	main-captions	MSRvid	2012test	692	none	none	A small monkey walks through water.	A monkey is wading across a marsh.	3.4
5988	main-captions	MSRvid	2012train	684	none	none	Women are holding each other and dancing together.	Two men are playing table tennis.	0.0
6257	main-captions	track5.en-en	2017	16	none	none	a woman watches a rap group live	An audience watches a girl dance.	2.2
205	main-captions	MSRvid	2012test	299	none	none	A man is playing with frogs	A cat is playing with a camera.	0.75
1332	main-captions	images	2014	489	none	none	Two women shopping at a clothing store.	Two women in a clothing store.	4.6
1580	main-captions	images	2015	252	none	none	A dog runs through the grass.	A dog runs through the snow.	2.2
5834	main-captions	MSRvid	2012test	495	none	none	A man is cleaning a fish on a kitchen counter.	A man is playing a flute.	0.8
1632	main-captions	images	2015	401	none	none	Two men on the side of a barge	A man is lying the grass with long hair and beard.	0.0
1148	main-captions	images	2014	213	none	none	Two people paddling in a red canoe with trees in the background.	Two people padding in a yellow canoe down a river with trees in the background.	3.4
1948	main-captions	images	2015	1345	none	none	A dog in in a car.	A dog is biting a mop.	1.0
6227	main-captions	images	2015	1200	none	none	A black and brown dog is chewing on a large stick.	A black and white dog playing in the sand.	1.8
474	main-captions	MSRvid	2012test	713	none	none	A man seated is playing the guitar.	A man is playing an acoustic guitar and singing into a microphone.	3.25
794	main-captions	MSRvid	2012train	439	none	none	A man is adding oil to car.	A man is putting anti-freeze into a car.	2.0
1863	main-captions	images	2015	1125	none	none	A girl with a black purse sitting on a wooden bench.	A young woman with a black purse sits on a wooden bench.	4.6
1980	main-captions	images	2015	1440	none	none	Two dogs run side-by-side on the grass.	Two dogs running on grass.	4.4
1512	main-captions	images	2015	42	none	none	A dog is jumping up in the air to catch a toy.	A black dog jumps in the air to catch a toy.	4.0
401	main-captions	MSRvid	2012test	605	none	none	A man making a bed in a hotel.	A man is holding a animal.	0.8
479	main-captions	MSRvid	2012test	722	none	none	A man is playing a wooden flute while several other men play bongo drums.	A man is playing a flute.	3.25
616	main-captions	MSRvid	2012train	176	none	none	A man is writing in a book.	A man is writing on a paper.	2.875
6312	main-captions	track5.en-en	2017	129	none	none	One football player tries to tackle a player on the opposing team.	A football player attempts a tackle.	4.6
5786	main-captions	MSRvid	2012test	219	none	none	A man plays the piano.	A man is playing a piano.	5.0
241	main-captions	MSRvid	2012test	359	none	none	Three boys are dancing.	Kids are dancing.	3.111
800	main-captions	MSRvid	2012train	452	none	none	A gun is being fired.	A potato is being peeled.	0.5
5822	main-captions	MSRvid	2012test	431	none	none	A man is talking with other women on the beach.	A man is walking down the street.	0.0
1034	main-captions	images	2014	50	none	none	A close-up, distorted photo of an empty glass Coke bottle.	A close-up picture of a desk with a computer and papers on it.	0.0
288	main-captions	MSRvid	2012test	430	none	none	The elephants sprayed water on themselves.	Elephants spray themselves with water.	3.6
1545	main-captions	images	2015	176	none	none	a dog is running across the sand with a stick in it's mouth.	A dog is running through a creek with a stick in its mouth.	3.6
