index	genre	filename	year	old_index	source1	source2	sentence1	sentence2	score
980	main-captions	MSRvid	2012train	714	none	none	The doctor was helping the patient.	Doctors are trying to revive a man.	2.8
456	main-captions	MSRvid	2012test	689	none	none	A boy is crawling into a dog house.	A cat is playing on the floor.	0.0
5904	main-captions	MSRvid	2012train	185	none	none	Three men are dancing.	Women are dancing.	1.3
1769	main-captions	images	2015	821	none	none	Two little girls are playing on a trampoline.	Two little boys are playing on a playground.	1.4
1881	main-captions	images	2015	1168	none	none	This over the top photo shows two men taking a break.	A person with swim cap and goggles taking a breath.	0.4
1866	main-captions	images	2015	1131	none	none	A large white and grey dog runs through a yellow tunnel in an obstacle course.	A white and black dog is running out of a yellow and orange tube.	3.6
625	main-captions	MSRvid	2012train	193	none	none	A woman is slicing up some meat.	A woman is slicing some onions.	2.0
6324	main-captions	track5.en-en	2017	149	none	none	A boy does a skateboard trick on the stairs downtown.	a boy is running on the sidewalk	0.6
1498	main-captions	images	2015	4	none	none	a bird lands in the water.	a boat floats in the water.	0.6
1309	main-captions	images	2014	450	none	none	Black and white cow standing in grassy field.	A black and white horned cow standing in a field.	3.8
1935	main-captions	images	2015	1317	none	none	A dog is running through a backyard full of leaves.	Three dogs run through a field.	2.8
1646	main-captions	images	2015	454	none	none	Two terriers play on the wood floor of their home.	Two puppies play with a red chew toy in a field.	1.6
475	main-captions	MSRvid	2012test	715	none	none	A woman is slicing an onion with a knife.	A man is preparing some dish.	1.25
5873	main-captions	MSRvid	2012test	717	none	none	A woman is peeling an orange.	A woman cuts off a small piece of lemon rind.	1.8
451	main-captions	MSRvid	2012test	681	none	none	A person checks some rice pudding.	A horse is running.	0.0
6197	main-captions	images	2015	803	none	none	Black and white dog running through water.	A tan and white dog runs through water.	3.0
1716	main-captions	images	2015	661	none	none	A dog running through a forest in the winter time	A dog running through a lot of twigs.	3.2
680	main-captions	MSRvid	2012train	267	none	none	A woman is boiling shrimp.	A woman is combing her hair.	1.0
1985	main-captions	images	2015	1468	none	none	A group of people are walking down the sidewalk of a big city.	A group of people are riding in the back of a truck.	1.0
17	main-captions	MSRvid	2012test	26	none	none	A woman is writing.	A woman is swimming.	0.5
1861	main-captions	images	2015	1116	none	none	Two black dogs playing in the snow.	A black dog digs in the snow.	3.4
6045	main-captions	images	2014	287	none	none	Two women sitting in lawn chairs.	Two women are sitting in a cafe.	2.6
1786	main-captions	images	2015	863	none	none	A man with a messenger bag in front of a gray tile wall.	Man in red jacket standing in front of lighthouse.	0.8
589	main-captions	MSRvid	2012train	140	none	none	A woman is slicing a carrot.	A man is slicing a tomato.	1.2
1674	main-captions	images	2015	519	none	none	Two dogs playing in the snow.	Two kids playing with a dog.	1.2
6122	main-captions	images	2015	54	none	none	A dog runs on brown grass.	A wet dog runs through the yellow grass holding a tennis ball.	2.2
914	main-captions	MSRvid	2012train	620	none	none	A man puts a knife in a vice.	A man is dancing.	0.25
772	main-captions	MSRvid	2012train	404	none	none	A man does floor exercises.	A man is exercising.	3.6
6014	main-captions	images	2014	73	none	none	A jockey riding a horse in a pen.	A jockey rides a horse at a gallop.	3.6
85	main-captions	MSRvid	2012test	123	none	none	A woman is slicing tomato.	A man is slicing onion.	1.6
798	main-captions	MSRvid	2012train	446	none	none	A woman is slicing pumpkin.	A person is slicing cantaloupe.	2.0
398	main-captions	MSRvid	2012test	601	none	none	Paper is being cut with scissors.	A piece of paper is being cut.	4.0
492	main-captions	MSRvid	2012test	748	none	none	A badger is digging in the dirt.	A man is moving large rocks.	0.0
1131	main-captions	images	2014	190	none	none	Two birds are perched on a metal band.	Two small birds perched on a metal bar.	4.0
341	main-captions	MSRvid	2012test	510	none	none	The missile exploded.	A rocket exploded.	3.2
1558	main-captions	images	2015	205	none	none	A black poodle plays in the snow.	A black poodle frolics in the snow.	5.0
5833	main-captions	MSRvid	2012test	488	none	none	The man used a sword to slice a plastic bottle.	A man sliced a plastic bottle with a sword.	5.0
902	main-captions	MSRvid	2012train	602	none	none	A man is cutting grass.	A masked man sings.	0.0
357	main-captions	MSRvid	2012test	530	none	none	The person lit the cameras on fire.	A person is blow torching cameras.	3.333
1597	main-captions	images	2015	312	none	none	a boy plays with a noodle by the pool.	A boy plays with a foam noodle toy by a pool.	4.6
1618	main-captions	images	2015	368	none	none	A blue and white soccer team playing against each other.	A topless woman with her face painted is covered in mud.	0.0
1609	main-captions	images	2015	344	none	none	Young boys running along the pavement.	A black dog running along the edge of the ocean.	0.5
719	main-captions	MSRvid	2012train	321	none	none	The woman is riding a horse.	A man is riding a horse in an arena.	2.0
490	main-captions	MSRvid	2012test	746	none	none	A man is running on a street.	A man plays the guitar.	0.8
6189	main-captions	images	2015	733	none	none	The two dogs are playing fetch in the snow.	The dogs play in the snow.	4.0
1715	main-captions	images	2015	656	none	none	A dog is jumping into a swimming pool after a duck.	A dog jumping into a swimming pool.	3.4
531	main-captions	MSRvid	2012train	58	none	none	A turtle is walking.	A tortoise is walking.	4.4
1201	main-captions	images	2014	298	none	none	A table and chairs are in a room with a picture on the wall and a ceiling fan.	A school bus driving down a road with green trees and grass in the background.	0.0
5824	main-captions	MSRvid	2012test	446	none	none	A chef is preparing some food.	A chef prepared a meal.	4.0
5935	main-captions	MSRvid	2012train	390	none	none	A woman is cutting potato.	A woman is riding a horse.	0.75
1229	main-captions	images	2014	336	none	none	A steam engine and train moving toward the camera.	A large bird of prey flying towards the camera.	0.8
6001	main-captions	images	2014	13	none	none	A bull standing in the field.	A brown horse stands in a lush green field.	1.4
5894	main-captions	MSRvid	2012train	124	none	none	A man is dancing.	A man is singing.	1.25
386	main-captions	MSRvid	2012test	586	none	none	Two puppies are playing with each other.	Some men are playing soccer.	0.2
462	main-captions	MSRvid	2012test	695	none	none	A boy takes off his sunglasses.	A boy is screaming.	0.5
255	main-captions	MSRvid	2012test	380	none	none	A man is buttering a piece of bread.	A man is applying butter to bread.	5.0
6306	main-captions	track5.en-en	2017	117	none	none	four people walk toward a tower	Two men walk toward a dome-shaped building.	2.0
945	main-captions	MSRvid	2012train	663	none	none	the soccer player kicked the ball side to side between his legs.	A person is kicking a soccer ball back and forth between his feet.	3.4
292	main-captions	MSRvid	2012test	438	none	none	A badger is burrowing a hole.	A badger is digging the earth.	4.6
204	main-captions	MSRvid	2012test	298	none	none	A woman holds a kangaroo.	A woman is picking up a kangaroo.	3.25
1341	main-captions	images	2014	499	none	none	Two brunette girls sit atop a red an yellow motorcycle with a side car.	A couple posing on a red and yellow motorcycle.	3.2
510	main-captions	MSRvid	2012train	33	none	none	A girl is playing a guitar.	A man is playing a guitar.	2.8
5828	main-captions	MSRvid	2012test	462	none	none	Five kittens are eating out of five dishes.	Kittens are eating food on trays.	2.75
6009	main-captions	images	2014	44	none	none	A bag of cotton in front of a couch.	Calico cat sitting on step in front of a door.	0.0
6295	main-captions	track5.en-en	2017	98	none	none	A young boy has a red fishing pole.	A young boy stands over a bridge with a fishing pole.	3.0
6364	main-captions	track5.en-en	2017	223	none	none	The player shoots the winning points.	The basketball player is about to score points for his team.	2.8
187	main-captions	MSRvid	2012test	275	none	none	A man and a woman talk in a diner.	A man and a woman are riding on a bicycle.	1.2
1766	main-captions	images	2015	813	none	none	a black dog swimming through a river.	a black dog digging through the snow.	1.2
372	main-captions	MSRvid	2012test	559	none	none	A man is moving a tree limb.	The woman is playing the violin.	0.0
1043	main-captions	images	2014	62	none	none	A women laying across two men sitting on a sofa.	A man and two women smiling at the camera while sitting on a blue sofa.	2.2
1477	main-captions	images	2014	716	none	none	sheep standing in afield.	A large dog stands next to a sheep in a field.	2.8
513	main-captions	MSRvid	2012train	37	none	none	A woman thinly slices an onion with a large knife.	A woman is slicing onions with a large knife.	4.2
6311	main-captions	track5.en-en	2017	128	none	none	A dog is chasing cows.	A white dog is chasing cows.	4.0
6096	main-captions	images	2014	645	none	none	Left side of a silver train engine.	A close-up of a black train engine.	2.2
1153	main-captions	images	2014	222	none	none	A bicycle is parked outside a bookstore.	People stand outside a bookstore.	0.8
380	main-captions	MSRvid	2012test	576	none	none	Two men are fighting.	Two men are fighting using a form of martial arts.	2.8
727	main-captions	MSRvid	2012train	333	none	none	A woman is stirring rice in a pot.	Someone is putting rice in a pan.	2.769
363	main-captions	MSRvid	2012test	542	none	none	The little boy is singing and playing the guitar.	A baby is playing a guitar.	2.8
1885	main-captions	images	2015	1178	none	none	A dog digging in the sand.	A brown dog digs in the sand.	4.2
801	main-captions	MSRvid	2012train	454	none	none	A woman is cutting a plastic sheet.	A woman is playing a guitar on streets.	0.5
773	main-captions	MSRvid	2012train	406	none	none	A man is slicing a potatoe.	A man is peeling a banana.	1.0
66	main-captions	MSRvid	2012test	101	none	none	A man and a woman are kissing.	A man and woman kiss.	5.0
563	main-captions	MSRvid	2012train	102	none	none	Someone is pouring oil into a skillet.	Someone is pouring milk into a blender.	1.6
1316	main-captions	images	2014	461	none	none	A young girl riding a brown horse.	A woman in riding a brown horse.	3.8
6117	main-captions	images	2015	16	none	none	Two gray dogs run together over the green grass.	Two grey dogs running in green grass.	4.6
378	main-captions	MSRvid	2012test	571	none	none	The cat is drinking milk.	A cat is licking from a saucer of milk.	4.4
144	main-captions	MSRvid	2012test	210	none	none	A man cuts up potatos.	A man slices potatoes.	4.8
1936	main-captions	images	2015	1319	none	none	two puppies playing around in the grass	Two puppies play in the grass	5.0
6285	main-captions	track5.en-en	2017	83	none	none	The man is in a deserted field.	The man is outside in the field.	4.0
1273	main-captions	images	2014	399	none	none	A girl with a red bag standing on the street.	A black dog is staring at a sheep.	0.0
6205	main-captions	images	2015	887	none	none	A dog and cat laying down together.	Two grey dogs are carrying a stick in the water.	0.6
366	main-captions	MSRvid	2012test	547	none	none	A woman is firing a rifle.	A man is performing stunts.	0.25
212	main-captions	MSRvid	2012test	312	none	none	The woman is cutting cooked octopus.	A woman is chopping octopus.	3.8
1005	main-captions	images	2014	7	none	none	a woman at a dinner table writing on her notebook.	Woman at table busy with something.	3.4
1413	main-captions	images	2014	614	none	none	A bicycle is parked by a shop.	A green bike parked outside a book store.	3.8
908	main-captions	MSRvid	2012train	612	none	none	A woman is cutting scallions.	A woman falls on a sand castle.	0.0
712	main-captions	MSRvid	2012train	312	none	none	A woman is smoking.	A woman is making some food.	0.8
134	main-captions	MSRvid	2012test	198	none	none	Two women are wrestling.	Two women are wrestling on the floor.	4.0
5845	main-captions	MSRvid	2012test	550	none	none	A woman is riding a horse along a perimeter.	A dog is riding a skateboard.	0.6
1161	main-captions	images	2014	232	none	none	A small white dog chews on a twig while lying on a wooden deck.	The white dog is laying on the wooden floor underneath the table.	1.6
6073	main-captions	images	2014	544	none	none	A man jumping his dirt bike.	A man on a bike jumping through the air.	3.6
1738	main-captions	images	2015	716	none	none	A man wearing a orange vest is canoeing in the blue water.	A man in an orange jacket raising his hands to the sky in the sand.	1.8
528	main-captions	MSRvid	2012train	55	none	none	A person folds a tortilla.	A man folds a tortilla.	3.5
6248	main-captions	images	2015	1476	none	none	Two dogs approach each other in the grass.	Two dogs face off of each other on the grass.	4.8
1224	main-captions	images	2014	331	none	none	A train sitting on the tracks near a field.	A baby is sitting in the grass.	0.0
1143	main-captions	images	2014	208	none	none	A plane flying at a distance.	A woman with a white horse.	0.0
6331	main-captions	track5.en-en	2017	161	none	none	The fruits should be eaten with lemon juice in order to prevent oxidation in your stomach.	three dogs growling On one another	0.0
1473	main-captions	images	2014	711	none	none	A boat is on the water near a small plane.	A boat is in the water and a small airplane is on the dock.	3.4
1957	main-captions	images	2015	1365	none	none	People are standing on an escalator moving up.	People ride up an escalator.	4.6
1905	main-captions	images	2015	1225	none	none	a snowboarder jumps into the air.	A snowboarder flies through the air.	4.0
994	main-captions	MSRvid	2012train	741	none	none	The man is playing the wooden flute.	A little boy is vacuuming the floor.	0.0
175	main-captions	MSRvid	2012test	259	none	none	A man is folding paper.	A woman is slicing a pepper.	0.6
1331	main-captions	images	2014	488	none	none	A close up of the front end of a purple and white motor cycle.	Close up of the rear of a red sports car.	1.2
1572	main-captions	images	2015	233	none	none	A blonde dog is catching a ball in its mouth in the snow.	A little blonde girl is sitting on a green chair.	0.0
803	main-captions	MSRvid	2012train	456	none	none	A woman is adding spices on a meat.	A woman adds ingredients to beef.	3.75
1092	main-captions	images	2014	129	none	none	The men are playing a guitar and having a drink.	There is a young boy with a red and blue jacket on feeding a sheep.	0.0
1317	main-captions	images	2014	463	none	none	Two women in the kitchen looking at a object.	Three men in suits sitting at a table.	0.0
195	main-captions	MSRvid	2012test	288	none	none	Two dogs swim in a pool.	Dogs are swimming in a pool.	4.2
416	main-captions	MSRvid	2012test	626	none	none	A person is peeling a potato.	A cat is licking a small bottle.	0.0
1891	main-captions	images	2015	1195	none	none	A group of people standing outside of a building.	A large group of people have formed a line outside.	3.2
880	main-captions	MSRvid	2012train	566	none	none	A person is cutting garlic into pieces with a knife.	Someone is putting ingredients into a wok.	0.75
543	main-captions	MSRvid	2012train	74	none	none	A woman is cutting a leak.	A woman is slicing a leek.	4.0
100	main-captions	MSRvid	2012test	145	none	none	A man is playing a guitar.	Someoen is playing guitar.	3.6
1496	main-captions	images	2014	749	none	none	A small brown birds is eating from a bird feeder hanging from a tree.	A small red and grey bird perched in a tree.	2.0
5774	main-captions	MSRvid	2012test	147	none	none	A girl is riding a horse.	A girl is riding a bicycle.	1.917
232	main-captions	MSRvid	2012test	344	none	none	A man is selling items.	A man is cleaning the house.	0.8
88	main-captions	MSRvid	2012test	129	none	none	A small dog is chasing a yoga ball.	A dog is chasing a ball.	4.0
817	main-captions	MSRvid	2012train	478	none	none	A man is kicking oots of water.	A woman is slicing a red pepper.	0.25
1792	main-captions	images	2015	877	none	none	a man walks two dogs on leashes down the street	A man walks two dogs in the city.	4.2
1920	main-captions	images	2015	1261	none	none	The tan and white dog is running in the field.	The brown and white dogs run through the field.	3.4
844	main-captions	MSRvid	2012train	514	none	none	A woman is doing weight exercises.	A woman is exercising with a barbell.	3.5
1577	main-captions	images	2015	244	none	none	A black dog running through water.	A black dog is running through some water.	4.8
1568	main-captions	images	2015	228	none	none	A little girl holds a wooden stick.	A little girl swimming in a pool.	2.2
1188	main-captions	images	2014	275	none	none	A line outside of a bookstore on a street.	The yellow motorcycle is parked on the street.	0.4
1909	main-captions	images	2015	1232	none	none	A man jumps off of one rooftop onto another.	A young man jumps from one balcony to another.	2.8
344	main-captions	MSRvid	2012test	513	none	none	A boy is pushing a van.	A person is slicing a tomato.	0.0
530	main-captions	MSRvid	2012train	57	none	none	A person is driving a car.	A man is driving a car.	3.5
1223	main-captions	images	2014	330	none	none	The train sits at the train station.	The blue train is at the station.	4.0
1942	main-captions	images	2015	1335	none	none	A person climbs up a snowy hill while their dog follows.	A person climbs a snowy hill while a black dog follows.	3.8
1155	main-captions	images	2014	225	none	none	Two red buses parked up with gardens in front of them.	Red buses are parked by a large white building beside a formal garden.	3.4
1208	main-captions	images	2014	311	none	none	The two dogs blend in with the stuff animals.	Two dogs sit on a couch with many stuffed animals.	3.4
6077	main-captions	images	2014	563	none	none	A long-haired man with a hat standing between two large, half-empty Coke bottles.	A man with a cap and jacket walking between two large bottles.	3.6
1083	main-captions	images	2014	114	none	none	A white animal running through snow covered woods.	A white dog runs through a snow covered wood.	3.4
1736	main-captions	images	2015	713	none	none	A man is scalling a sheer rock face with a rope support.	A young man is doing a ski jump with a purple board.	0.4
5891	main-captions	MSRvid	2012train	78	none	none	The man is smashing garlic.	A man is smashing some garlic.	5.0
127	main-captions	MSRvid	2012test	188	none	none	A boy is playing an instrument.	A man is playing a trumpet.	2.5
661	main-captions	MSRvid	2012train	244	none	none	A man stares out a window.	A man looks out the window.	4.8
61	main-captions	MSRvid	2012test	89	none	none	A man chops down a tree with an axe.	A man cut a tree with an axe.	4.75
810	main-captions	MSRvid	2012train	468	none	none	A man is playing the piano.	Someone is playing guitar.	0.75
744	main-captions	MSRvid	2012train	357	none	none	A man is eating wood.	A man is adding oil to car.	0.5
62	main-captions	MSRvid	2012test	90	none	none	A kid plays with a toy phone.	A little boy plays with a toy phone.	3.5
952	main-captions	MSRvid	2012train	677	none	none	A man and woman dance.	A man is petting a dog.	0.333
342	main-captions	MSRvid	2012test	511	none	none	A dog is playing in the snow.	A dog is pawing at a fly in the carpet before it.	1.6
6264	main-captions	track5.en-en	2017	36	none	none	Four girls happily walk down a sidewalk.	Three young girls walk down a sidewalk.	3.4
1575	main-captions	images	2015	237	none	none	A woman and a dog standing in the grass.	A man carries a sign while standing in the rain.	0.0
98	main-captions	MSRvid	2012test	143	none	none	A man is slicing potatoes.	A woman is peeling potato.	2.2
1481	main-captions	images	2014	722	none	none	Two dogs in a fenced kennel look ahead.	Two girls on a guy posing on the bow a boat.	0.0
6116	main-captions	images	2014	747	none	none	A blue scooter parked on a sidewalk.	A blue moped parked on the sidewalk.	4.2
6323	main-captions	track5.en-en	2017	147	none	none	A lady and her daughter look through a microscope.	A girl and a lady both looking through a microscope.	4.6
1761	main-captions	images	2015	791	none	none	A teenage girl running on a beach shouting, with an older man walking behind her.	a young child running along the shore at a beach	1.8
536	main-captions	MSRvid	2012train	64	none	none	A man is cutting an onion.	A man is cutting a plantain.	3.667
5965	main-captions	MSRvid	2012train	539	none	none	A baby eats his food.	A baby is being fed peas.	3.0
1656	main-captions	images	2015	482	none	none	a group of old men walking down the street	A couple walking down the street.	2.0
1090	main-captions	images	2014	127	none	none	The bald eagle is perched on a rope.	Two bald eagles perched on a branch.	2.6
769	main-captions	MSRvid	2012train	399	none	none	A woman is adding an egg and stirring.	A woman is mixing an egg in a bowl.	3.5
5951	main-captions	MSRvid	2012train	450	none	none	A man is playing a guitar.	A woman is riding a horse.	0.5
355	main-captions	MSRvid	2012test	528	none	none	A man is riding a horse and jumping over obstacles.	A man is kicking a soccer ball.	0.333
6218	main-captions	images	2015	1030	none	none	A boy is jumping into the water with a ball in his hand.	A little boy swimming underwater with a toy in his hand.	2.2
5970	main-captions	MSRvid	2012train	579	none	none	A woman is riding a horse on the beach.	A woman is washing a bowl.	0.2
161	main-captions	MSRvid	2012test	238	none	none	A man is playing a guitar.	A man is stabbing a target.	1.2
516	main-captions	MSRvid	2012train	40	none	none	A woman is peeling a potato.	A woman peels a potato.	5.0
653	main-captions	MSRvid	2012train	235	none	none	A woman is washing her hands.	A woman is straightening her hair.	0.8
5850	main-captions	MSRvid	2012test	568	none	none	A man is screwing wood to a wall.	A man is giving a woman a massage.	0.2
931	main-captions	MSRvid	2012train	641	none	none	The man sang on stage into the microphone.	A man in a suit is standing at a microphone and singing.	3.5
776	main-captions	MSRvid	2012train	411	none	none	The woman droppped eggplant into the pan.	A woman puts chopped eggplant into a skillet.	4.0
6017	main-captions	images	2014	108	none	none	One Asian and one occasion woman in glasses smiling with their thumbs up.	Two women are posing for the camera and giving the thumbs up sign.	3.4
611	main-captions	MSRvid	2012train	170	none	none	A woman is cracking eggs into a bowl.	A woman is cracking eggs.	4.0
1514	main-captions	images	2015	46	none	none	The two boys play in the field.	The two people have their heads covered with scarves.	0.0
1688	main-captions	images	2015	561	none	none	A dog with big ears is holding a small stick in it's mouth.	A puppy with big ears chewing on a stick.	3.8
6024	main-captions	images	2014	164	none	none	A cat looking at the camera.	A grey, black, and white cat looking at the camera.	4.0
846	main-captions	MSRvid	2012train	516	none	none	A large bird standing on a table picks up a plastic glass containing liquid and places it in a bowl of something.	A bird picks up a plastic cup containing a liquid with it's beak and puts the cup into a bowl.	3.5
1462	main-captions	images	2014	693	none	none	A television in a messy room with several bookcases.	A room with a television, stereo and bookshelf.	3.2
5961	main-captions	MSRvid	2012train	528	none	none	A man is stirring ingredients in a bowl.	A man is beating two eggs in a bowl with a fork.	2.75
1303	main-captions	images	2014	443	none	none	A pug dog wits on a yellow chair next to a green dumpster.	A bulldog sitting on a yellow chair beside a large waste receptacle.	3.2
1925	main-captions	images	2015	1291	none	none	A young men jumps off rocks into a lake.	A young man in red swimming trunks jumped off a large rock into the water.	4.0
828	main-captions	MSRvid	2012train	490	none	none	A man is placing meat in a bag.	A man is drivong a car.	0.5
6070	main-captions	images	2014	511	none	none	Young baby girl sitting on table.	A woman with a smiling baby sitting on the table.	1.6
6133	main-captions	images	2015	165	none	none	A woman is sitting up asleep with her head resting on her hand.	A man who is resting his head on his hand.	2.2
6195	main-captions	images	2015	781	none	none	A woman stands with her arms out at her sides while another takes a picture.	A man stands in a crowd holding a white object.	0.4
1476	main-captions	images	2014	715	none	none	A black and white cat is sitting on a brown chair looking up.	A dog sitting on a yellow chair next to a green dumpster.	0.4
5780	main-captions	MSRvid	2012test	189	none	none	A band is performing on a stage.	A band is playing onstage.	5.0
1185	main-captions	images	2014	271	none	none	Two brown horses standing in grassy field.	Two men sailing in a small sailboat.	0.0
982	main-captions	MSRvid	2012train	719	none	none	A baby is talking.	A boy is trying to say firetruck.	1.2
1099	main-captions	images	2014	138	none	none	A black and white photo of an empty train station.	a black and white photo of a cat lying down.	1.6
1970	main-captions	images	2015	1397	none	none	A brown dog is jumping up to catch a green strap in it's mouth.	A grey dog jumps to bite a green leash.	3.2
933	main-captions	MSRvid	2012train	644	none	none	A man is holding a frog.	A man is emptying a plastic container.	0.6
6055	main-captions	images	2014	380	none	none	Large white cruise ship floating on water.	Large cruise ship floating on the water.	4.6
335	main-captions	MSRvid	2012test	500	none	none	A man is breaking water jugs.	A woman is peeling garlic.	0.2
